stop_name,bus_boardings,integration_index,neighborhood
CENTRE AVE AT PROTECTORY PL,430.0,7.701976931815774,Crawford-Roberts
CENTRE AVE AT REED ST,50.0,0.0,Middle Hill
CENTRE AVE AT ROBERTS ST,330.0,13.271907435635866,Crawford-Roberts
CENTRE AVE AT SHADYSIDE HOSPITAL,290.0,0.0,Shadyside
CENTRE AVE AT SOHO ST,190.0,2.7452556100998047,Middle Hill
CENTRE AVE AT NEGLEY AVE (MARKET DISTRICT),4050.0,719.7596853117278,Shadyside
CENTRE AVE AT SOHO ST,190.0,2.951526790637872,Middle Hill
CENTRE AVE AT WATT ST,100.0,0.0,Middle Hill
CENTRE AVE OPP ALLEQUIPPA ST,290.0,7.339658891374218,Upper Hill
CENTRE AVE OPP BRYN MAWR RD,140.0,0.0,North Oakland
CENTRE AVE OPP CYPRESS ST,380.0,0.0,Shadyside
CENTRE AVE AT ADDISON ST,1140.0,178.69402073379084,Middle Hill
CENTRE AVE AT S EUCLID AVE,140.0,2.630352810736845,East Liberty
CENTRE AVE OPP FRANCIS ST,670.0,0.0,Terrace Village
CENTRE AVE AT ROBINSON ST EXT,100.0,0.0,Terrace Village
CENTRE AVE OPP MILLVALE AVE,240.0,79.37910124091452,Shadyside
CENTRE AVE OPP MORGAN ST,620.0,0.0,Middle Hill
CENTRE AVE OPP NEVILLE ST,670.0,35.85906541952446,Bloomfield
CENTRE AVE OPP SHADYSIDE HOSPITAL,380.0,0.0,Bloomfield
CENTRE AVE OPP WATT ST,380.0,0.0,Terrace Village
CHISLETT ST AT HAMPTON ST,50.0,0.0,Morningside
CHISLETT ST AT VILLANOVA RD,50.0,0.0,Morningside
COAL ST OPP HUTCHINSON AVE,50.0,0.0,Unknown
COREY AVE AT BRADDOCK AVE,190.0,0.0,Unknown
COREY AVE AT MARGARETTA ST,50.0,0.0,Unknown
CRAIG ST AT FIFTH AVE,900.0,45.18662132590587,North Oakland
CRAIG ST AT BAUM BLVD FS,100.0,2.963266100003201,North Oakland
CRAIG ST AT BAYARD ST,950.0,36.47521906264799,North Oakland
CRAIG ST AT BAYARD ST,380.0,12.750057598684508,North Oakland
CRAIG ST OPP BIGELOW BLVD,190.0,0.0,North Oakland
CRAIG ST AT CENTRE AVE,1810.0,140.01209358553808,North Oakland
CRAIG ST AT PARK PLAZA,430.0,20.548885641119906,North Oakland
EAST LIBERTY BLVD AT BROAD ST,140.0,0.0,East Liberty
EAST LIBERTY BLVD AT DAHLEM PL,100.0,2.9541235966148034,Larimer
EAST LIBERTY BLVD AT FRANKSTOWN AVE,670.0,0.0,Larimer
EAST LIBERTY BLVD AT HAMILTON AVE,50.0,0.0,Larimer
EAST LIBERTY BLVD AT PENN AVE,100.0,2.8055367968889002,East Liberty
FIFTH AVE RAMP AT FIFTH AVE FS,760.0,31.900291742101746,Larimer
DARRAGH ST OPP VICTORIA ST,50.0,1.995576744043454,West Oakland
DEAN ST AT PAULSON AVE,50.0,0.0,Lincoln-Lemington-Belmar
DEVILLIERS ST AT WEBSTER AVE,140.0,3.5558926464052925,Middle Hill
DEVILLIERS ST AT WYLIE AVE,50.0,2.13933865128231,Middle Hill
DEVILLIERS ST AT WYLIE AVE,50.0,2.1572988198637715,Crawford-Roberts
DOBSON ST AT HERRON AVE,290.0,0.0,Polish Hill
DYNAMO WAY AT BEECH ST,100.0,0.0,Unknown
EAST BUSWAY AT HAMNETT STATION C,140.0,0.0,Unknown
EAST BUSWAY AT HAMNETT STATION A,50.0,0.0,Unknown
EAST BUSWAY AT HAY ST RAMP INBOUND SHELTER,50.0,0.0,Unknown
EAST BUSWAY AT HAY ST RAMP OUTBOUND SHELTER,380.0,0.0,Unknown
EAST BUSWAY AT ROSLYN STATION C,710.0,0.0,Unknown
EAST BUSWAY AT ROSLYN STATION A,480.0,0.0,Unknown
EAST BUSWAY AT SWISSVALE STATION A,4140.0,0.0,Unknown
EAST BUSWAY AT EAST LIBERTY STATION D,190.0,18.57006732929673,Shadyside
EAST BUSWAY AT WILKINSBURG STATION B,1140.0,130.56337291944104,Unknown
EAST BUSWAY AT HOMEWOOD STATION D,100.0,3.043393149005444,Homewood South
EAST BUSWAY AT WILKINSBURG STATION C,1670.0,204.97027460695426,Unknown
EAST BUSWAY AT WILKINSBURG STATION A,1710.0,138.1644241302337,Unknown
EAST BUSWAY AT HOMEWOOD STATION C,1380.0,38.18706828517293,Homewood South
EAST BUSWAY AT HOMEWOOD STATION A,1240.0,36.37193269672373,Homewood South
EAST BUSWAY AT EAST LIBERTY STATION C,2430.0,182.51493593481354,Shadyside
EAST BUSWAY AT EAST LIBERTY STATION A,2620.0,371.37245983194435,Shadyside
EAST BUSWAY AT NEGLEY STATION C,810.0,122.8795988475168,Shadyside
EAST BUSWAY AT NEGLEY STATION A,950.0,399.54166258656005,Shadyside
EAST BUSWAY AT HERRON STATION C,50.0,1.2350722066698225,Polish Hill
EAST BUSWAY AT EAST LIBERTY STATION B,190.0,14.464920640632432,Shadyside
EAST BUSWAY AT HOMEWOOD STATION B,100.0,2.5950306474119307,Homewood South
EAST BUSWAY AT GARAGE EMPLOYEES ONLY STOP,100.0,3.7511534191872418,Larimer
EAST BUSWAY AT WILKINSBURG STATION D,1710.0,142.8356077983558,Unknown
EAST LIBERTY BLVD AT HIGHLAND AVE FS,140.0,0.0,East Liberty
EAST LIBERTY BLVD AT CENTRE AVE,710.0,0.0,East Liberty
ECKSTEIN PL AT WADSWORTH ST,620.0,17.488415538539527,Terrace Village
ECKSTEIN PL AT WADSWORTH ST FS,950.0,26.24420225889146,Terrace Village
EDGEWOOD AVE AT ELM ST FS,50.0,0.0,Unknown
EDGEWOOD AVE OPP ELM ST,50.0,0.0,Unknown
EDGEWOOD AVE OPP LACROSSE AVE,50.0,0.0,Unknown
EDGEWOOD AVE AT SAILOR PL FS,50.0,0.0,Unknown
EDGEWOOD TOWNE CENTRE AT DOLLAR TREE,290.0,0.0,Unknown
EDGEWOOD TOWNE CENTRE AT GIANT EAGLE FS,290.0,0.0,Unknown
ELECTRIC AVE OPP DYNAMO WAY,50.0,0.0,Unknown
ELLA ST AT LIBERTY AVE,190.0,15.428892779997577,Bloomfield
ELLSWORTH AVE AT AIKEN AVE,290.0,5.407035105359532,Shadyside
ELLSWORTH AVE AT AIKEN AVE,240.0,4.329878747039887,Shadyside
ELLSWORTH AVE AT AMBERSON AVE,50.0,0.0,Shadyside
ELLSWORTH AVE AT FILBERT ST,50.0,1.5503517501061963,Shadyside
ELLSWORTH AVE AT MARYLAND AVE,100.0,5.206574409941326,Shadyside
ELLSWORTH AVE AT NEGLEY AVE,50.0,2.841225961708003,Shadyside
ELLSWORTH AVE AT NEGLEY AVE,50.0,2.4777936045113593,Shadyside
EUCLID AVE AT BUNKERHILL ST,50.0,0.0,Highland Park
EUCLID AVE AT CALLOWHILL ST,100.0,0.0,Highland Park
FORBES AVE AT ATWOOD ST,1620.0,140.6180804547703,Central Oakland
FORBES AVE AT BEECHWOOD BLVD,50.0,0.0,Squirrel Hill South
FORBES AVE AT BEELER ST,190.0,0.0,Squirrel Hill North
FORBES AVE AT BOUQUET ST FS,50.0,8.11977298221915,Central Oakland
FORBES AVE AT BOYD ST (DUQUESNE UNIV),760.0,19.288024674011055,Bluff
FORBES AVE AT BRADDOCK AVE FS,100.0,0.0,Point Breeze
FORBES AVE AT CRAFT AVE FS,950.0,28.22177802729387,South Oakland
FORBES AVE AT CRAIG ST,240.0,24.13916658303779,North Oakland
FORBES AVE AT DALLAS AVE,50.0,0.0,Point Breeze
FORBES AVE AT SHADY AVE,240.0,0.0,Squirrel Hill North
FORBES AVE AT DENNISTON ST,380.0,0.0,Squirrel Hill South
FORBES AVE AT DITHRIDGE ST,380.0,25.96469242883203,North Oakland
FORBES AVE AT GIST ST,140.0,0.0,Bluff
FORBES AVE AT HALKET ST (MAGEE HOSPITAL),1050.0,73.28441171148432,South Oakland
FORBES AVE AT MCANULTY DR,710.0,0.0,Bluff
FORBES AVE AT JUMONVILLE ST,240.0,0.0,Bluff
FORBES AVE AT MAGEE ST,50.0,0.0,Bluff
FORBES AVE AT MARGARET MORRISON ST NS,50.0,0.0,Squirrel Hill North
FORBES AVE AT MCKEE PL,330.0,32.87236536380913,Central Oakland
FORBES AVE AT MEYRAN AVE,140.0,7.788446387527645,Central Oakland
FORBES AVE AT MILTENBERGER ST,290.0,0.0,Bluff
FORBES AVE AT OAKLAND AVE,330.0,37.41231900272074,Central Oakland
FORBES AVE PAST MOREWOOD AVE (,620.0,14.529791925322444,Squirrel Hill North
FORBES AVE AT MOULTRIE ST,140.0,0.0,Bluff
FORBES AVE AT MURDOCH ST,50.0,0.0,Squirrel Hill North
FORBES AVE AT MURDOCH ST,50.0,0.0,Squirrel Hill South
FORBES AVE AT MURRAY AVE FS,1520.0,0.0,Squirrel Hill North
FORBES AVE AT MURRAY AVE,1100.0,0.0,Squirrel Hill South
FORBES AVE AT NORTHUMBERLAND ST FS,50.0,0.0,Squirrel Hill North
FORBES AVE AT PLAINFIELD ST,50.0,0.0,Squirrel Hill North
FORBES AVE AT PRIDE ST (MERCY HOSPITAL),1240.0,0.0,Bluff
FORBES AVE AT SENECA ST,100.0,0.0,Bluff
FORBES AVE AT SHADY AVE,290.0,0.0,Squirrel Hill South
FORBES AVE AT STEVENSON ST,140.0,0.0,Bluff
FORBES AVE AT VAN BRAAM ST,290.0,0.0,Bluff
FORBES AVE AT WIGHTMAN ST,50.0,0.0,Squirrel Hill North
FORBES AVE AT WIGHTMAN ST,240.0,0.0,Squirrel Hill South
FORBES AVE OPP BEELER ST,100.0,0.0,Squirrel Hill North
FORBES AVE OPP BELLEFIELD AVE NS,810.0,64.01949834962532,North Oakland
FORBES AVE OPP CRAIG ST,290.0,20.210034143594637,North Oakland
FORBES AVE OPP MARGARET MORRISON ST,290.0,0.0,Squirrel Hill North
FORBES AVE OPP MOREWOOD AVE (CARNEGIE MELLON),290.0,0.0,Squirrel Hill North
FRANKSTOWN AVE AT 5TH AVE,140.0,4.025637671135352,Larimer
FRANKSTOWN AVE AT BENNETT ST FS,240.0,0.0,Homewood West
FRANKSTOWN AVE AT BRADDOCK AVE,100.0,1.562920268532466,Homewood North
FRANKSTOWN AVE AT BRADDOCK AVE,100.0,1.637853270683923,Homewood South
FRANKSTOWN AVE AT BRUSHTON AVE,190.0,2.372352776505354,Homewood North
FRANKSTOWN AVE AT BRUSHTON AVE,100.0,1.3239473690939576,Homewood South
FRANKSTOWN AVE AT COLLIER ST,100.0,1.5077359510114268,Homewood North
FRANKSTOWN AVE AT COLLIER ST,100.0,1.4731791852319942,Homewood South
FRANKSTOWN AVE AT EAST VIEW ST,50.0,0.0,Homewood West
FRANKSTOWN AVE AT FINLEY ST NS,50.0,1.8788068619249565,Larimer
FRANKSTOWN AVE AT HOMEWOOD AVE,860.0,38.387164589587016,Homewood South
FRANKSTOWN AVE AT HOMEWOOD HOUSE,380.0,23.41258827423197,Homewood South
FRANKSTOWN AVE AT JULIUS ST,100.0,2.3487096812156034,Larimer
FRANKSTOWN AVE AT LANG AVE NS,480.0,15.71053782849124,Homewood North
FRANKSTOWN AVE AT LANG AVE,140.0,3.8094608069586116,Homewood South
FRANKSTOWN AVE AT LINCOLN AVE,190.0,0.0,Larimer
FRANKSTOWN AVE AT MURTLAND ST,140.0,1.7184342824586716,Homewood North
FRANKSTOWN AVE AT MURTLAND ST,480.0,5.3987108381802775,Homewood West
FRANKSTOWN AVE AT OAKWOOD ST,380.0,0.0,Homewood South
FRANKSTOWN RD AT OVERBROOK RD,380.0,0.0,Unknown
FRANKSTOWN AVE AT PAULSON AVE,50.0,0.0,Larimer
FRANKSTOWN RD AT ROBINSON BLVD NS,100.0,0.0,Unknown
FRANKSTOWN RD AT EYMARD ST FS,140.0,0.0,East Hills
FRANKSTOWN AVE AT STERRETT ST,190.0,2.5758259594757837,Homewood North
FRANKSTOWN AVE AT STERRETT ST,100.0,1.4817590105516387,Homewood South
FRANKSTOWN AVE AT WASHINGTON BLVD,50.0,1.2331990632576257,Homewood West
FRANKSTOWN AVE AT WILKINSBURG AVE FS,50.0,0.0,East Hills
FRANKSTOWN RD AT WOODS RD,190.0,0.0,Unknown
FRANKSTOWN RD OPP WOODS RD,50.0,0.0,East Hills
FRANKSTOWN AVE OPP LINCOLN AVE,140.0,0.0,Larimer
FRANKSTOWN AVE OPP OAKWOOD ST,190.0,0.0,Homewood North
FRANKSTOWN AVE AT LAWNDALE ST,100.0,0.0,Homewood North
FRANKSTOWN RD AT 1ST REFORMED CHURCH,50.0,0.0,Unknown
FRANKSTOWN RD OPP BON AIR RD,50.0,0.0,Unknown
FRANKSTOWN RD AT DUFF RD FS,330.0,0.0,Unknown
FRANKSTOWN RD AT MCCLUTCHEON LN,50.0,0.0,Unknown
FRANKSTOWN RD AT RITZLAND RD,50.0,0.0,Unknown
FRANKSTOWN RD AT ROBINSON BLVD FS,50.0,0.0,Unknown
FRANKSTOWN RD OPP DUFF RD,100.0,0.0,Unknown
FRANKSTOWN RD AT PENN ARBORS DR FS,290.0,0.0,Unknown
FRANKSTOWN RD OPP RODI RD,50.0,0.0,Unknown
FRANKSTOWN RD AT SHENANDOAH DR,50.0,0.0,Unknown
FRIENDSHIP AVE AT AIKEN AVE,140.0,2.819835817697402,Bloomfield
FRIENDSHIP AVE AT AIKEN AVE,100.0,2.127198959787415,Bloomfield
FRIENDSHIP AVE AT ATLANTIC AVE,190.0,5.082048248806591,Bloomfield
FRIENDSHIP AVE AT EDMOND ST,50.0,1.2578884650399722,Bloomfield
FRIENDSHIP AVE AT FAIRMOUNT ST,50.0,0.0,Friendship
FRIENDSHIP AVE AT GRAHAM ST,100.0,0.0,Bloomfield
FRIENDSHIP AVE AT GROSS ST,50.0,1.4329606813994278,Bloomfield
FRIENDSHIP AVE AT MILLVALE AVE,100.0,2.528806660063598,Bloomfield
FRIENDSHIP AVE AT MILLVALE AVE,50.0,1.4355052772834864,Bloomfield
FRIENDSHIP AVE AT NEGLEY AVE,50.0,0.0,Friendship
FRIENDSHIP AVE AT PEARL ST,50.0,1.8206360856039112,Bloomfield
FRIENDSHIP AVE AT PEARL ST,50.0,2.0453665537960086,Bloomfield
FRIENDSHIP AVE AT EDMOND ST,50.0,1.3412371716336005,Bloomfield
GRANDVIEW AVE AT BESSEMER AVE NS,100.0,0.0,Unknown
GREENFIELD AVE AT IRVINE ST,100.0,5.361018185936114,Hazelwood
GREENFIELD AVE AT SECOND AVE,190.0,12.732418191632194,Hazelwood
GREENFIELD AVE AT LYDIA ST,50.0,0.0,Greenfield
GREENFIELD AVE AT LORETTA ST,140.0,0.0,Greenfield
GREENFIELD AVE AT WINTERBURN AVE FS,100.0,0.0,Greenfield
GREENFIELD AVE AT WINDSOR ST FS,50.0,0.0,Greenfield
GREENFIELD AVE AT IRVINE ST FS,50.0,2.064987048848661,Hazelwood
GREENFIELD AVE AT KEARCHER ST,100.0,0.0,Greenfield
GREENFIELD AVE OPP KEARCHER ST,100.0,0.0,Greenfield
GREENFIELD AVE AT HOOSAC ST FS,50.0,0.0,Greenfield
HAMILTON AVE AT FIFTH AVE,100.0,3.696912746947848,Homewood West
HAMILTON AVE AT BRADDOCK AVE,140.0,14.134360162309905,Homewood South
HAMILTON AVE AT BRADDOCK AVE,50.0,12.142378308334102,Homewood South
HAMILTON AVE AT BRUSHTON AVE,50.0,1.111025969840084,Homewood South
HAMILTON AVE AT BRUSHTON AVE,50.0,1.3389416026736005,Homewood South
HAMILTON AVE AT COLLIER ST,50.0,1.5176280607340527,Homewood South
HAMILTON AVE AT DALLAS AVE,50.0,0.0,Homewood West
HAMILTON AVE AT HOMEWOOD AVE,140.0,21.060437850209027,Homewood South
HAMILTON AVE AT HOMEWOOD AVE,140.0,20.843824515727327,Homewood South
HAMILTON AVE AT JULIUS ST,50.0,1.663471194726518,Larimer
HAMILTON AVE AT LANG AVE,100.0,2.8132449471743617,Homewood South
HAMILTON AVE AT LANG AVE,100.0,2.491071473921588,Homewood South
HAMILTON AVE AT MURTLAND ST,50.0,0.0,Homewood West
HARRIET ST OPP BLDG #2,50.0,0.0,Unknown
HAWKINS AVE AT 4TH ST,570.0,0.0,Unknown
HAWKINS AVE AT 4TH ST,570.0,0.0,Unknown
HAWKINS AVE AT MIDDLE ST,100.0,0.0,Unknown
HAWKINS AVE OPP OVERLAND ST,50.0,0.0,Unknown
RANKIN BLVD AT HAWKINS AVE,570.0,0.0,Unknown
HAWKINS AVE AT #552,140.0,0.0,Unknown
HAY ST AT PENN AVE,140.0,2.1168759875140655,Unknown
HAZELWOOD AVE OPP GREENFIELD AVE,50.0,0.0,Greenfield
HERRON AVE AT HANCOCK ST,330.0,0.0,Polish Hill
HERRON AVE AT LIBERTY AVE,50.0,2.6277824408522266,Lower Lawrenceville
HIGHLAND AVE AT ALDER ST,50.0,1.0599458644996778,Shadyside
HIGHLAND AVE AT EAST LIBERTY BLVD,50.0,0.0,East Liberty
HIGHLAND AVE AT EAST LIBERTY BLVD,240.0,0.0,East Liberty
HIGHLAND AVE AT HAYS ST,140.0,0.0,East Liberty
HIGHLAND AVE AT JACKSON ST,50.0,0.0,Highland Park
HIGHLAND AVE AT PENN AVE,290.0,25.838875324492438,East Liberty
HIGHLAND AVE AT STATION ST,50.0,1.3999321814180892,East Liberty
HIGHLAND AVE OPP BAUM BLVD,100.0,5.537565837873778,East Liberty
HIGHLAND AVE OPP ELWOOD ST,50.0,0.0,Shadyside
HIGHLAND AVE AT STANTON AVE,330.0,0.0,Highland Park
HIGHLAND AVE AT STANTON AVE,240.0,0.0,East Liberty
HIGHLAND AVE AT VINTAGE SENIOR CITIZEN CTR,290.0,0.0,East Liberty
HIGHLAND AVE OPP HAYS ST,240.0,0.0,East Liberty
HILLCREST ST AT AIKEN AVE,50.0,3.788792799658659,Garfield
HOMEWOOD AVE AT BENNETT ST,50.0,3.7495668554986126,Homewood South
HOMEWOOD AVE AT FINANCE ST (EAST BUSWAY),100.0,3.404965116161102,Homewood South
HOMEWOOD AVE AT FRANKSTOWN AVE,100.0,4.045425492701324,Homewood North
HOMEWOOD AVE AT HAMILTON AVE,50.0,10.790713609942554,Homewood South
HOMEWOOD AVE AT HAMILTON AVE,190.0,24.06726944228669,Homewood South
HOMEWOOD AVE AT HERMITAGE ST,140.0,0.0,Homewood North
HOMEWOOD AVE OPP FINANCE ST (EAST BUSWAY),380.0,14.208355223827777,Homewood South
HOMEWOOD AVE AT MT VERNON ST,50.0,0.0,Homewood North
HOMEWOOD AVE AT RACE ST,50.0,0.8199197375449165,Homewood North
HOMEWOOD AVE AT THOMAS BLVD,50.0,0.0,Point Breeze North
HOMEWOOD AVE AT THOMAS BLVD,50.0,0.0,Point Breeze North
IMOGENE RD AT BROWNS HILL RD FS,100.0,0.0,Hazelwood
IMOGENE RD AT BROWNS HILL RD,50.0,0.0,Squirrel Hill South
JAMES ST OPP HARPER DR,50.0,0.0,Unknown
JAMES ST AT CAROTHERS DR,100.0,0.0,Unknown
JAMES ST AT MONROEVILLE AVE,50.0,0.0,Unknown
JAMES ST AT BOONE DR,50.0,0.0,Unknown
JANCEY ST AT GREENWOOD ST,140.0,0.0,Morningside
JANCEY ST AT HAMPTON ST,50.0,0.0,Morningside
JANCEY ST AT MARTHA ST,50.0,0.0,Morningside
JANCEY ST AT WELLESLEY AVE,50.0,0.0,Morningside
JOHNSTON AVE AT SECOND AVE,290.0,5.308757920059785,Hazelwood
JOHNSTON AVE AT SECOND AVE FS,190.0,3.2876862482714997,Hazelwood
JOHNSTON AVE AT #657,100.0,0.0,Glen Hazel
JOHNSTON AVE AT #666,100.0,0.0,Glen Hazel
JOHNSTON AVE AT #857,50.0,0.0,Glen Hazel
JOHNSTON AVE OPP #857,100.0,0.0,Glen Hazel
JOHNSTON AVE AT GERTRUDE ST,190.0,2.96690890351757,Hazelwood
JOHNSTON AVE AT GLENWOOD AVE,240.0,0.0,Hazelwood
JOHNSTON AVE AT GLENWOOD AVE,190.0,0.0,Hazelwood
JOHNSTON AVE AT WINSTON ST,50.0,0.0,Hazelwood
JOHNSTON AVE AT RIVERMONT DR FS,100.0,0.0,Glen Hazel
JOHNSTON AVE AT MANSION ST,290.0,0.0,Hazelwood
JOHNSTON AVE AT MANSION ST,50.0,0.0,Hazelwood
JOHNSTON AVE AT RIVERMONT DR,100.0,0.0,Glen Hazel
JOHNSTON AVE AT ROSELLE CT FS,3810.0,0.0,Glen Hazel
JOHNSTON AVE OPP ROSELLE CT,3760.0,0.0,Glen Hazel
JOHNSTON AVE AT #635,100.0,0.0,Glen Hazel
JOHNSTON AVE OPP #643,50.0,0.0,Glen Hazel
JOHNSTON AVE OPP BROADVIEW DR,50.0,0.0,Glen Hazel
JONES AVE OPP HAWKINS AVE,190.0,0.0,Unknown
JUMONVILLE ST AT WATSON ST,240.0,0.0,Bluff
KELLY AVE AT HAY ST,380.0,0.0,Unknown
KELLY AVE AT PITT ST,50.0,0.0,Unknown
KELLY AVE AT WEST ST,190.0,0.0,Unknown
KELLY AVE AT PITT ST,50.0,0.0,Unknown
LAKETON RD AT DOUGLAS DR FS,290.0,0.0,Unknown
LAKETON RD AT DOYLE ST FS,100.0,0.0,Unknown
LAKETON RD AT LINDBERG AVE,50.0,0.0,Unknown
LAKETON RD OPP NELBON AVE,100.0,0.0,Unknown
LAKETON RD OPP DOUGLAS PLAZA APTS,50.0,0.0,Unknown
LAKETON RD AT WOODGATE RD,50.0,0.0,Unknown
LAKETON RD AT LINDBERG AVE,50.0,0.0,Unknown
LAKETON RD OPP TURNER AVE,50.0,0.0,Unknown
LARIMER AVE AT APPLE ST,100.0,0.0,Lincoln-Lemington-Belmar
LARIMER AVE AT DEAN ST,50.0,0.0,Lincoln-Lemington-Belmar
LEECHBURG RD AT GARDEN DR,50.0,0.0,Unknown
LEMINGTON AVE AT WARDSONS ST,100.0,0.0,Lincoln-Lemington-Belmar
LIBERTY AVE AT 12TH ST,100.0,1.7938696668101068,Strip District
LIBERTY AVE AT 14TH ST,50.0,0.0,Strip District
LIBERTY AVE AT 17TH ST,1050.0,118.00566578078796,Strip District
LIBERTY AVE AT 21ST ST,1570.0,122.45070671825398,Strip District
LIBERTY AVE AT 25TH ST,190.0,4.810057321562704,Strip District
LIBERTY AVE AT 26TH ST,50.0,1.2883596433310838,Strip District
LIBERTY AVE AT 28TH ST,50.0,0.0,Strip District
LIBERTY AVE AT 29TH ST,140.0,0.0,Strip District
LIBERTY AVE AT 30TH ST,240.0,0.0,Strip District
LIBERTY AVE AT 31ST ST,100.0,2.121563387061267,Strip District
LIBERTY AVE AT 34TH ST,50.0,1.5466952005028012,Lower Lawrenceville
LIBERTY AVE AT 37TH ST,100.0,0.0,Lower Lawrenceville
LIBERTY AVE AT 39TH ST,50.0,0.0,Lower Lawrenceville
LIBERTY AVE AT 40TH ST NS,50.0,0.0,Bloomfield
LIBERTY AVE AT BAUM BLVD,50.0,0.0,Bloomfield
LIBERTY AVE AT BAUM BLVD,190.0,0.0,Bloomfield
LIBERTY AVE AT CANOE WAY,240.0,4.213150830369589,Bloomfield
LIBERTY AVE AT EDMOND ST,50.0,1.3471890951273469,Bloomfield
LIBERTY AVE AT EDMOND ST,290.0,7.88165783932819,Bloomfield
LIBERTY AVE AT ELLA ST,290.0,25.92660570652708,Bloomfield
LIBERTY AVE AT ELLA ST,430.0,28.388622234442018,Bloomfield
LIBERTY AVE AT GROSS ST,50.0,29.139245435414384,Bloomfield
LIBERTY AVE AT LIGONIER ST (HERRON AVE),100.0,4.919131175614746,Lower Lawrenceville
LIBERTY AVE AT HERRON AVE,100.0,6.452483138207821,Lower Lawrenceville
LIBERTY AVE OPP MAIN ST (BLOOMFIELD BRIDGE),50.0,1.5146426418267809,Bloomfield
LIBERTY AVE AT MAIN ST FS,380.0,9.49163925513283,Bloomfield
LIBERTY AVE AT MATHILDA ST (WEST PENN HOSP),100.0,4.001909825055213,Bloomfield
LIBERTY AVE AT MILLVALE AVE,50.0,5.451515275857508,Bloomfield
LIBERTY AVE AT MILLVALE AVE (WEST PENN HOSP),190.0,15.222963580482936,Bloomfield
LIBERTY AVE AT EVALINE ST,140.0,3.175076103948954,Bloomfield
LIBERTY AVE AT OSCEOLA ST,190.0,4.360127937934162,Bloomfield
LIBERTY AVE OPP PACIFIC AVE,140.0,0.0,Bloomfield
LIBERTY AVE AT PEARL ST,100.0,6.304887066988605,Bloomfield
LIBERTY AVE AT PEARL ST,50.0,3.620756933667075,Bloomfield
LIBERTY AVE AT WINEBIDDLE ST,50.0,2.8518486535702254,Bloomfield
LIBERTY AVE OPP 14TH ST,140.0,0.0,Strip District
LIBERTY AVE OPP 17TH ST,900.0,102.83229096944295,Strip District
LIBERTY AVE OPP 21ST ST FS,1240.0,80.46979728873266,Strip District
LIBERTY AVE OPP 26TH ST,50.0,1.292724510638187,Strip District
LIBERTY AVE OPP 27TH ST,190.0,3.8488808460522974,Strip District
LIBERTY AVE OPP 31ST ST,290.0,5.496879590455082,Polish Hill
LIBERTY AVE AT 32ND ST NS,50.0,1.7137316506035758,Polish Hill
LIBERTY AVE AT 36TH ST,50.0,0.9691857850611572,Lower Lawrenceville
LIBERTY AVE OPP 37TH ST,50.0,0.0,Lower Lawrenceville
LIBERTY AVE AT 40TH ST,140.0,0.0,Lower Lawrenceville
LINCOLN AVE AT APPLE ST,140.0,0.0,Homewood North
LINCOLN AVE AT CAMPANIA ST,100.0,0.0,Lincoln-Lemington-Belmar
LINCOLN AVE AT FRANKSTOWN AVE,100.0,0.0,Larimer
LINCOLN AVE AT LEMINGTON AVE,140.0,0.0,Lincoln-Lemington-Belmar
LINCOLN AVE AT LEMINGTON AVE,480.0,0.0,Lincoln-Lemington-Belmar
LINCOLN AVE AT VERONA BLVD,570.0,0.0,Lincoln-Lemington-Belmar
LINCOLN AVE AT MEADOW ST,100.0,1.6941300949517588,Larimer
LINCOLN AVE AT UPLAND ST,100.0,0.0,Homewood West
LINCOLN AVE AT LEMINGTON HOME DRVWY,330.0,0.0,Lincoln-Lemington-Belmar
LINCOLN AVE OPP MAYFLOWER ST (#408),140.0,2.43399050019798,Larimer
LINCOLN AVE AT SHETLAND ST,140.0,0.0,Larimer
LINCOLN AVE AT VASSAR ST FS,240.0,0.0,Lincoln-Lemington-Belmar
LINCOLN AVE OPP CHAUCER ST,190.0,0.0,Lincoln-Lemington-Belmar
LINCOLN AVE OPP CHURCHLAND ST,100.0,0.0,Lincoln-Lemington-Belmar
LINCOLN AVE OPP LEMINGTON HOME DRVWY,430.0,0.0,Lincoln-Lemington-Belmar
LINCOLN AVE OPP WILTSIE ST,50.0,0.0,Lincoln-Lemington-Belmar
LINCOLN AVE AT VERONA BLVD,620.0,0.0,Lincoln-Lemington-Belmar
LINCOLN AVE OPP RENFREW ST,50.0,0.0,Larimer
LINCOLN HWY AT LINCOLN SQ SR CITIZEN HOME,50.0,0.0,Unknown
LINDEN AVE OPP SR CITIZEN APTS,100.0,0.0,Unknown
LINDEN AVE OPP BESSEMER AVE FS,50.0,0.0,Unknown
LONG RD AT JOAN DR,50.0,0.0,Unknown
KANE CENTER MAIN ENTRANCE (GLE,190.0,0.0,Glen Hazel
MAIN ST AT CENTER AVE,140.0,0.0,Unknown
MAIN ST AT CENTER AVE,140.0,0.0,Unknown
MAIN ST AT HOWARD ST,190.0,0.0,Unknown
MAIN ST AT HOWLEY ST,290.0,7.607628394238218,Bloomfield
MAIN ST AT MAPLE ST,330.0,0.0,Unknown
MAIN ST AT PENN AVE NS,140.0,0.0,Bloomfield
MAIN ST AT RIDGE AVE,240.0,0.0,Unknown
MAIN ST AT HOWLEY ST FS,330.0,9.636396496487981,Bloomfield
MALL BLVD AT #120 (AT HOME STORE),50.0,0.0,Unknown
MARK DR AT #7865,50.0,0.0,Unknown
MIDDLE ST AT HAWKINS AVE,330.0,0.0,Unknown
MILLER AVE AT GAS ST,50.0,0.0,Unknown
MILLVALE AVE AT BAUM BLVD,100.0,7.848701433851572,Bloomfield
MILLVALE AVE AT BAUM BLVD,50.0,3.34995678395479,Bloomfield
MILLVALE AVE AT CENTRE AVE,430.0,91.1759477716706,Bloomfield
MILLVALE AVE AT CENTRE AVE FS,140.0,19.901037185661234,Bloomfield
MILLVALE AVE AT CYPRESS ST,50.0,1.8486868791688593,Bloomfield
MILLVALE AVE AT CYPRESS ST,140.0,5.48666989935334,Bloomfield
MILLVALE AVE AT MOREWOOD AVE,50.0,1.6036993904939665,Bloomfield
MONONGAHELA AVE AT CHURCH ST,570.0,0.0,Unknown
MONONGAHELA AVE AT CHURCH ST,430.0,0.0,Unknown
MONONGAHELA AVE AT IRVINE ST,100.0,0.0,Unknown
MONONGAHELA AVE AT MCCLURE AVE,50.0,0.0,Unknown
MONONGAHELA AVE AT SCHOYER AVE,100.0,0.0,Unknown
MONONGAHELA AVE AT WASHINGTON ST,50.0,0.0,Unknown
MONROEVILLE BLVD OPP BRINTON ST,50.0,0.0,Unknown
SALTSBURG RD OPP MONROEVILLE TRESTLE RD,140.0,0.0,Unknown
MONTIER ST AT BESSICA ST,100.0,0.0,Unknown
MONTIER ST AT HERR ST,100.0,0.0,Unknown
MONTIER ST AT LAKETON RD FS,50.0,0.0,Unknown
MT CARMEL RD AT ABER RD,330.0,0.0,Unknown
MT CARMEL RD AT CALMAR DR,50.0,0.0,Unknown
MT CARMEL RD AT PERSHING ST,50.0,0.0,Unknown
MT CARMEL RD OPP HIGHLANDVIEW ST,50.0,0.0,Unknown
MURRAY AVE AT BARTLETT ST,430.0,0.0,Squirrel Hill South
MURRAY AVE AT BARTLETT ST FS,330.0,0.0,Squirrel Hill South
MURRAY AVE AT BEACON ST,330.0,0.0,Squirrel Hill South
MURRAY AVE AT BEACON ST NS,710.0,0.0,Squirrel Hill South
MURRAY AVE OPP BURCHFIELD AVE,190.0,0.0,Squirrel Hill South
MURRAY AVE AT DARLINGTON RD,190.0,0.0,Squirrel Hill South
MURRAY AVE AT FLEMINGTON ST,100.0,0.0,Greenfield
MURRAY AVE AT FLEMINGTON ST FS,50.0,0.0,Greenfield
MURRAY AVE AT FORBES AVE,100.0,0.0,Squirrel Hill South
MURRAY AVE AT FORBES AVE FS,330.0,0.0,Squirrel Hill North
MURRAY AVE AT FORBES AVE,330.0,0.0,Squirrel Hill North
MURRAY AVE AT FORWARD AVE FS,520.0,0.0,Squirrel Hill South
MURRAY AVE AT FORWARD AVE,760.0,0.0,Squirrel Hill South
MURRAY AVE AT HAZELWOOD AVE FS,520.0,0.0,Greenfield
MURRAY AVE AT HAZELWOOD AVE,140.0,0.0,Greenfield
MURRAY AVE AT HOBART ST,50.0,0.0,Squirrel Hill South
MURRAY AVE AT HOBART ST,290.0,0.0,Squirrel Hill South
MURRAY AVE AT LILAC ST,240.0,0.0,Greenfield
MURRAY AVE AT LILAC ST,100.0,0.0,Greenfield
MURRAY AVE AT LORETTA ST,520.0,0.0,Greenfield
MURRAY AVE AT LORETTA ST,670.0,0.0,Greenfield
MURRAY AVE AT MORROWFIELD AVE FS,190.0,0.0,Squirrel Hill South
MURRAY AVE OPP MORROWFIELD AVE,480.0,0.0,Squirrel Hill South
MURRAY AVE AT PHILLIPS AVE,140.0,0.0,Squirrel Hill South
MURRAY AVE AT PHILLIPS AVE,430.0,0.0,Squirrel Hill South
MURRAY AVE AT #2825,380.0,0.0,Squirrel Hill South
MURRAY AVE AT WELFER ST,50.0,0.0,Greenfield
MURRAY AVE AT WELFER ST,50.0,0.0,Greenfield
NEGLEY AVE AT #370 (BAUM BLVD),100.0,4.600998160239363,Friendship
NEGLEY AVE AT BLACK ST,330.0,0.0,East Liberty
NEGLEY AVE AT BROAD ST,50.0,0.0,Garfield
NEGLEY AVE AT CENTRE AVE,1520.0,582.1224357507444,Friendship
NEGLEY AVE OPP CLAYBOURNE ST,50.0,4.8974000372141,Shadyside
NEGLEY AVE AT CORAL ST,100.0,0.0,Friendship
NEGLEY AVE AT EAST BUSWAY STEPS,290.0,23.83070646066055,Shadyside
NEGLEY AVE AT EAST LIBERTY BLVD,140.0,0.0,East Liberty
NEGLEY AVE AT FRIENDSHIP AVE,50.0,0.0,Friendship
NEGLEY AVE AT FRIENDSHIP AVE,50.0,0.0,East Liberty
NEGLEY AVE AT HAYS ST,140.0,0.0,East Liberty
NEGLEY AVE AT KENTUCKY AVE,50.0,1.7040743210742233,Shadyside
NEGLEY AVE AT MARGARETTA ST,140.0,0.0,Garfield
NEGLEY AVE AT PENN AVE,430.0,0.0,East Liberty
NEGLEY AVE AT PENN AVE FS,1810.0,0.0,Friendship
NEGLEY AVE AT BROAD ST FS,140.0,0.0,East Liberty
NEGLEY AVE AT RURAL ST,100.0,0.0,East Liberty
NEGLEY AVE AT STANTON AVE,240.0,0.0,Highland Park
NEGLEY AVE AT STANTON AVE,100.0,0.0,East Liberty
NEGLEY AVE AT WALNUT ST,100.0,6.106180167227361,Shadyside
NEGLEY AVE OPP CORAL ST,100.0,0.0,East Liberty
NEGLEY AVE OPP RURAL ST,100.0,0.0,Garfield
NEVILLE RAMP AT CENTRE AVE,100.0,4.614912157733772,Bloomfield
NEVILLE RAMP AT CENTRE AVE FS,100.0,4.837815962677455,Bloomfield
NEVILLE ST AT FIFTH AVE,50.0,5.334064799419041,North Oakland
NEVILLE ST AT BAYARD ST,50.0,1.870536023318656,North Oakland
NEVILLE ST AT ELLSWORTH AVE NS,50.0,9.098016923504645,Shadyside
NOBLE ST AT WASHINGTON ST,330.0,0.0,Unknown
NOBLE ST OPP WASHINGTON ST,100.0,0.0,Unknown
NOBLE ST AT DICKSON ST,50.0,0.0,Unknown
OAK HILL DR AT BENTLEY DR,190.0,0.0,Terrace Village
OAK HILL DR AT ECKSTEIN PL,620.0,0.0,Terrace Village
OAK HILL DR AT HYMAN PL,480.0,0.0,Terrace Village
OAKWOOD ST AT BENNETT ST,50.0,0.0,Homewood South
OAKWOOD ST AT FRANKSTOWN AVE,190.0,0.0,East Hills
OAKWOOD ST AT HAMILTON AVE,100.0,0.0,Homewood South
OAKWOOD ST AT INGLENOOK PL FS,50.0,0.0,Homewood South
OAKWOOD ST AT BENNETT ST,190.0,0.0,East Hills
OAKWOOD ST OPP INGLENOOK PL,50.0,0.0,East Hills
ORION ST AT MILWAUKEE ST,140.0,0.0,Upper Hill
PARK HILL DR AT #2101,100.0,0.0,East Hills
PATTON ST AT MIDDLE AVE,50.0,0.0,Unknown
PAULSON AVE AT DEAN ST,100.0,0.0,Lincoln-Lemington-Belmar
PAULSON AVE AT LEMINGTON AVE,50.0,0.0,Lincoln-Lemington-Belmar
